id,name,description
1,TrailMaster X4 Tent,"Unveiling the TrailMaster X4 Tent from OutdoorLiving, your home away from home for your next camping adventure. Crafted from durable polyester, this tent boasts a spacious interior perfect for four occupants. It ensures your dryness with its water-resistant construction and comes with an easy setup. This tent is your companion for unforgettable outdoor experiences!"
2,Adventurer Pro Backpack,"Introducing the Adventurer Pro Backpack from HikeMate, the epitome of ventilation and comfort. Featuring a breathable and adjustable harness, this backpack ensures a comfortable journey. The easy-access front pocket and built-in rain cover add to its convenience. This backpack is your perfect partner for every adventure!"
3,Summit Breeze Jacket,"Discover the Summit Breeze Jacket from MountainStyle, the perfect blend of style and function. This lightweight jacket boasts a waterproof exterior coupled with a breathable interior. It's equipped with an adjustable hood and multiple pockets for added utility. This jacket is your stylish yet functional solution to braving the elements!"
4,BaseCamp Folding Table,"Check out the BaseCamp Folding Table from CampBuddy, your perfect companion for outdoor dining. This table is lightweight and portable, designed for easy setup and takedown. Built with durable aluminum, it's the perfect balance of utility and convenience. Make your outdoor dining experiences seamless with this table!"
5,EcoFire Camping Stove,"Introducing the EcoFire Camping Stove from EcoGear, designed for low impact and high heat. This compact and lightweight stove is perfect for backpacking. It's easy to use and clean, plus it's compatible with various fuel types. Enjoy an eco-friendly cooking solution that doesn't compromise performance!"
6,CozyNights Sleeping Bag,"Stay warm with the CozyNights Sleeping Bag from SleepWell. This sleeping bag is insulated, lightweight, and compact, making it ideal for a variety of weather conditions. It features a hood and draft tube to keep you warm, and comes with a compression sack for easy storage. It's your comfort solution for outdoor nights!"
7,TrekReady Hiking Boots,"Step into adventure with the TrekReady Hiking Boots from TrekStar. These waterproof boots offer excellent ankle support and cushioning, thanks to their breathable design. They also feature a high-traction sole to keep you steady on any terrain. Get ready to tread any trail with confidence!"
8,RainGuard Hiking Jacket,"Don't let the rain stop you - grab a RainGuard Hiking Jacket from MountainStyle. This jacket offers a dependable waterproof layer with breathable fabric to keep you dry. It also features an adjustable hood and reflective accents for safety. Stay comfortable and visible even in the toughest weather with this jacket!"
9,StarGazer 8 Tent,"Behold the StarGazer 8 Tent from OutdoorLiving, a haven for large group camping. This tent offers ample space for eight people, with a roomy interior and multiple doors for easy access. It boasts a waterproof design and comes with a rainfly for extra protection. Experience comfort and security with this spacious tent!"
10,Adventure Dining Table,"Meet the Adventure Dining Table from CampBuddy, a lightweight yet sturdy piece of outdoor furniture. This table is compact and perfect for cooking or dining. It boasts an aluminum build and adjustable height for added versatility. Bring convenience to your outdoor culinary adventures with this table!"
